table_name,table_description_ko,table_description_en,domain,keywords,sample_queries
IP_PRODUCT_SCAN_MAPPING_HIST_DEL,제품 SCAN MAPPING 이력 테이블. 제품 SCAN MAPPING 변경/처리 이력을 기록한다.,Product SCAN MAPPING history table. Records product scan mapping change history.,생산,DEL HIST MAPPING PRODUCT SCAN 라인 생산 이력 제품,제품 이력 조회|제품 변경 이력
IP_PRODUCT_SELECTION_DATA_TEMP,제품 SELECTION 데이터 테이블. 제품 SELECTION 관련 데이터를 저장한다.,Product SELECTION data table. Stores product selection data.,생산,DATA PRODUCT SELECTION TEMP 데이터 라인 생산 온도 제품,제품 정보 조회|제품 현황
IP_PRODUCT_SENSOR_ACTUAL,제품 SENSOR 실적 테이블. 제품 관련 정보를 관리한다.,Product SENSOR Actual table. Manages product sensor actual information.,생산,ACTUAL PRODUCT SENSOR 라인 생산 실적 제품,제품 실적 조회|일일 제품 실적
IP_PRODUCT_SENSOR_ACTUAL_BACK,제품 SENSOR 실적 BACK 테이블. 제품 관련 정보를 관리한다.,Product SENSOR Actual table. Manages product sensor actual information.,생산,ACTUAL BACK PRODUCT SENSOR 라인 생산 실적 제품,제품 실적 조회|일일 제품 실적
IP_PRODUCT_SENSOR_ACTUAL_HOUR,제품 SENSOR 실적 HOUR 테이블. 제품 관련 정보를 관리한다.,Product SENSOR Actual table. Manages product sensor actual information.,생산,ACTUAL HOUR PRODUCT SENSOR 라인 생산 실적 제품,제품 실적 조회|일일 제품 실적
IP_PRODUCT_SENSOR_ACTUAL_RUNNO,제품 SENSOR 실적 RUNNO 테이블. 제품 관련 정보를 관리한다.,Product SENSOR Actual table. Manages product sensor actual information.,생산,ACTUAL PRODUCT RUNNO SENSOR 라인 생산 실적 제품,제품 실적 조회|일일 제품 실적
IP_PRODUCT_SENSOR_ACTUAL_TIME,제품 SENSOR 실적 TIME 테이블. 제품 관련 정보를 관리한다.,Product SENSOR Actual table. Manages product sensor actual information.,생산,ACTUAL PRODUCT SENSOR TIME 라인 생산 실적 제품,제품 실적 조회|일일 제품 실적
IP_PRODUCT_SERIAL_RESULT,제품 SERIAL 실적 테이블. 제품 SERIAL 실적 데이터를 기록한다.,Product SERIAL result table. Stores product serial result data.,생산,PRODUCT RESULT SERIAL 라인 생산 실적 제품,제품 실적 조회|일일 제품 실적
IP_PRODUCT_SHIFT_RESULT,제품 SHIFT 실적 테이블. 제품 SHIFT 실적 데이터를 기록한다.,Product SHIFT result table. Stores product shift result data.,생산,PRODUCT RESULT SHIFT 라인 생산 실적 제품,제품 실적 조회|일일 제품 실적
IP_PRODUCT_SMD_MONTH_PLAN,제품 SMD MONTH 계획 테이블. 제품 계획 정보를 관리한다.,Product SMD MONTH table. Manages product smd month information.,생산,MONTH PLAN PRODUCT SMD 계획 라인 생산 제품,제품 계획 조회|당일 제품 계획
IP_PRODUCT_SMD_PLAN,제품 SMD 계획 테이블. 제품 계획 정보를 관리한다.,Product SMD Plan table. Manages product smd plan information.,생산,PLAN PRODUCT SMD 계획 라인 생산 제품,제품 계획 조회|당일 제품 계획
IP_PRODUCT_SMD_PLAN_ISSUE,제품 SMD 계획 출고 테이블. 제품 계획 정보를 관리한다.,Product SMD Plan table. Manages product smd plan information.,생산,ISSUE PLAN PRODUCT SMD 계획 라인 생산 제품 출고,제품 계획 조회|당일 제품 계획
IP_PRODUCT_SOFTWARE_EXCEL,제품 SOFTWARE EXCEL 테이블. 제품 관련 정보를 관리한다.,Product SOFTWARE EXCEL table. Manages product software excel information.,생산,EXCEL PRODUCT SOFTWARE 라인 생산 제품,제품 정보 조회|제품 현황
IP_PRODUCT_SOFTWARE_MASTER,제품 SOFTWARE 마스터 테이블. 제품 SOFTWARE 정보를 관리한다.,Product SOFTWARE master table. Manages product software information.,생산,MASTER PRODUCT SOFTWARE 라인 마스터 생산 제품,제품 정보 조회|제품 목록
IP_PRODUCT_SPEC_CONFIRM_DOC,제품 스펙 CONFIRM DOC 테이블. 제품 관련 정보를 관리한다.,Product Specification CONFIRM table. Manages product specification confirm information.,생산,CONFIRM DOC PRODUCT SPEC 라인 생산 스펙 제품,제품 정보 조회|제품 현황
IP_PRODUCT_SPI_DAILY_RESULTS,제품 SPI 일일 RESULTS 테이블. 제품 관련 정보를 관리한다.,Product SPI Daily table. Manages product spi daily information.,생산,DAILY PRODUCT RESULTS SPI 라인 생산 일일 제품,제품 정보 조회|제품 현황
IP_PRODUCT_SSCD_DATA_CHECK,제품 SSCD 데이터 테이블. 제품 SSCD 관련 데이터를 저장한다.,Product SSCD data table. Stores product sscd data.,생산,CHECK DATA PRODUCT SSCD 검사 데이터 라인 생산 제품,제품 검사 결과|제품 검사 현황
IP_PRODUCT_ST,제품 ST 테이블. 제품 관련 정보를 관리한다.,Product ST table. Manages product st information.,생산,PRODUCT ST 라인 생산 제품,제품 정보 조회|제품 현황
IP_PRODUCT_VI_QC_IMAGE,제품 VI 품질관리 이미지 테이블. 제품 관련 정보를 관리한다.,Product VI Quality Control table. Manages product vi quality control information.,생산,IMAGE PRODUCT VI 라인 생산 이미지 제품 품질관리,제품 정보 조회|제품 현황
IP_PRODUCT_WORKORDER_DOCUMENT,제품 WORKORDER DOCUMENT 테이블. 제품 관련 정보를 관리한다.,Product WORKORDER DOCUMENT table. Manages product workorder document information.,생산,DOCUMENT PRODUCT WORKORDER 라인 생산 제품,제품 정보 조회|제품 현황
IP_PRODUCT_WORKSTAGE,제품 공정 테이블. 제품 관련 정보를 관리한다.,Product Work Stage table. Manages product work stage information.,생산,PRODUCT WORKSTAGE 공정 라인 생산 제품,제품 정보 조회|제품 현황
IP_PRODUCT_WORKSTAGE_INV,제품 공정 INV 테이블. 제품 관련 정보를 관리한다.,Product Work Stage INV table. Manages product work stage inv information.,생산,INV PRODUCT WORKSTAGE 공정 라인 생산 제품,제품 정보 조회|제품 현황
IP_PRODUCT_WORKSTAGE_IO,제품 공정 IO 테이블. 제품 관련 정보를 관리한다.,Product Work Stage IO table. Manages product work stage io information.,생산,IO PRODUCT WORKSTAGE 공정 라인 생산 제품,제품 정보 조회|제품 현황
IP_PRODUCT_WORKSTAGE_IO_DEL,제품 공정 IO DEL 테이블. 제품 관련 정보를 관리한다.,Product Work Stage IO table. Manages product work stage io information.,생산,DEL IO PRODUCT WORKSTAGE 공정 라인 생산 제품,제품 정보 조회|제품 현황
IP_PRODUCT_WORKSTAGE_RESULT,제품 공정 실적 테이블. 제품 공정 실적 데이터를 기록한다.,Product Work Stage result table. Stores product work stage result data.,생산,PRODUCT RESULT WORKSTAGE 공정 라인 생산 실적 제품,제품 실적 조회|일일 제품 실적
IP_PRODUCT_WORKSTAGE_REWORK,제품 공정 REWORK 테이블. 제품 관련 정보를 관리한다.,Product Work Stage REWORK table. Manages product work stage rework information.,생산,PRODUCT REWORK WORKSTAGE 공정 라인 생산 제품,제품 정보 조회|제품 현황
IP_PRODUCT_WORK_QC,제품 작업 품질관리 테이블. 제품 관련 정보를 관리한다.,Product Work Quality Control table. Manages product work quality control information.,생산,PRODUCT WORK 라인 생산 작업 제품 품질관리,제품 정보 조회|제품 현황
IP_PRODUCT_WORK_QC_EXCEL,제품 작업 품질관리 EXCEL 테이블. 제품 관련 정보를 관리한다.,Product Work Quality Control table. Manages product work quality control information.,생산,EXCEL PRODUCT WORK 라인 생산 작업 제품 품질관리,제품 정보 조회|제품 현황
IP_PRODUCT_WORK_QC_IMAGE,제품 작업 품질관리 이미지 테이블. 제품 관련 정보를 관리한다.,Product Work Quality Control table. Manages product work quality control information.,생산,IMAGE PRODUCT WORK 라인 생산 이미지 작업 제품 품질관리,제품 정보 조회|제품 현황
IP_PRODUCT_WORK_QC_REPAIR_ITEM,제품 작업 품질관리 수리 테이블. 제품 관련 정보를 관리한다.,Product Work Quality Control table. Manages product work quality control information.,생산,ITEM PRODUCT REPAIR WORK 라인 생산 수리 작업 제품 품목 품질관리,제품 정보 조회|제품 현황
IP_PRODUCT_WORK_TIME,제품 작업 TIME 테이블. 제품 관련 정보를 관리한다.,Product Work TIME table. Manages product work time information.,생산,PRODUCT TIME WORK 라인 생산 작업 제품,제품 정보 조회|제품 현황
IP_PRODUCT_WRONG_COMPONENT,제품 WRONG COMPONENT 테이블. 제품 관련 정보를 관리한다.,Product WRONG COMPONENT table. Manages product wrong component information.,생산,COMPONENT PRODUCT WRONG 라인 생산 제품,제품 정보 조회|제품 현황
IP_PRODUCT_WRONG_RETURN_PID,제품 WRONG RETURN PID 테이블. 제품 관련 정보를 관리한다.,Product WRONG RETURN table. Manages product wrong return information.,생산,PID PRODUCT RETURN WRONG 라인 생산 제품,제품 정보 조회|제품 현황
IP_PRODUCT_WS_CALENDAR,제품 WS CALENDAR 테이블. 제품 관련 정보를 관리한다.,Product WS CALENDAR table. Manages product ws calendar information.,생산,CALENDAR PRODUCT WS 라인 생산 제품,제품 정보 조회|제품 현황
IP_PRODUCT_WS_CAPACITY,제품 WS CAPACITY 테이블. 제품 관련 정보를 관리한다.,Product WS CAPACITY table. Manages product ws capacity information.,생산,CAPACITY PRODUCT WS 라인 생산 제품,제품 정보 조회|제품 현황
IP_PRODUCT_YEAR_BASE,제품 YEAR BASE 테이블. 제품 관련 정보를 관리한다.,Product YEAR BASE table. Manages product year base information.,생산,BASE PRODUCT YEAR 라인 생산 제품,제품 정보 조회|제품 현황
IP_PROD_MATERIAL_TRACKING_KFC,PROD 자재 TRACKING KFC 테이블. PROD 관련 정보를 관리한다.,PROD Material TRACKING table. Manages prod material tracking information.,생산,KFC MATERIAL PROD TRACKING 라인 생산 자재,PROD 정보 조회|PROD 현황
IP_SHIFT_TIME_MASTER,SHIFT TIME 마스터 테이블. SHIFT TIME 정보를 관리한다.,SHIFT TIME master table. Manages shift time information.,생산,MASTER SHIFT TIME 라인 마스터 생산,SHIFT 정보 조회|SHIFT 목록
IQC_INSPECTION_TEMPLATE,INSPECTION TEMPLATE 테이블. INSPECTION 관련 정보를 관리한다.,INSPECTION TEMPLATE table. Manages inspection template information.,기타,INSPECTION TEMPLATE,INSPECTION 정보 조회|INSPECTION 현황
IQC_INSPECTION_TIME_CHECK,INSPECTION TIME 검사/확인 테이블. INSPECTION 검사 결과를 기록한다.,INSPECTION TIME Check table. Manages inspection time check information.,기타,CHECK INSPECTION TIME 검사,INSPECTION 검사 결과|INSPECTION 검사 현황
IQ_4M_MASTER,4M 마스터 테이블. 4M 정보를 관리한다.,4M master table. Manages 4m information.,품질,4M MASTER 검사 마스터 품질,4M 정보 조회|4M 목록|품질 검사 현황
IQ_CHECK_FOOLPROOF_HISTORY,검사/확인 FOOLPROOF 이력 테이블. 검사/확인 FOOLPROOF 변경/처리 이력을 기록한다.,Check FOOLPROOF history table. Records check foolproof change history.,품질,CHECK FOOLPROOF HISTORY 검사 이력 품질,검사 이력 조회|검사 변경 이력|품질 검사 현황
IQ_DAILY_DASHBOARD,일일 DASHBOARD 테이블. 일일 관련 정보를 관리한다.,Daily DASHBOARD table. Manages daily dashboard information.,품질,DAILY DASHBOARD 검사 일일 품질,일일 정보 조회|일일 현황|품질 검사 현황
IQ_DAILY_NOTIFY,일일 NOTIFY 테이블. 일일 관련 정보를 관리한다.,Daily NOTIFY table. Manages daily notify information.,품질,DAILY NOTIFY 검사 일일 품질,일일 정보 조회|일일 현황|품질 검사 현황
IQ_INSPECT_MASTER_SAMPLE_LOG,검사 SAMPLE 마스터 테이블. 검사 SAMPLE 정보를 관리한다.,Inspection SAMPLE master table. Manages inspection sample information.,품질,INSPECT LOG MASTER SAMPLE 검사 로그 마스터 품질,검사 이력 조회|검사 변경 이력|품질 검사 현황
IQ_INSPECT_MAXPOWER_SPEC,검사 MAXPOWER 스펙 테이블. 검사 검사 결과를 기록한다.,Inspection MAXPOWER Specification table. Manages inspection maxpower specification information.,품질,INSPECT MAXPOWER SPEC 검사 스펙 품질,검사 검사 결과|검사 검사 현황|품질 검사 현황
IQ_INTERLOCK_CHECK_CONDITION,INTERLOCK 검사/확인 CONDITION 테이블. INTERLOCK 검사 결과를 기록한다.,INTERLOCK Check CONDITION table. Manages interlock check condition information.,품질,CHECK CONDITION INTERLOCK 검사 품질,INTERLOCK 검사 결과|INTERLOCK 검사 현황|품질 검사 현황
IQ_INTERLOCK_CHECK_COND_LOG,INTERLOCK 검사/확인 COND 로그 테이블. INTERLOCK 검사/확인 COND 변경/처리 이력을 기록한다.,INTERLOCK Check COND log table. Records interlock check cond change history.,품질,CHECK COND INTERLOCK LOG 검사 로그 품질,INTERLOCK 이력 조회|INTERLOCK 변경 이력|품질 검사 현황
IQ_INTERLOCK_CHECK_ERROR,INTERLOCK 검사/확인 에러 테이블. INTERLOCK 검사 결과를 기록한다.,INTERLOCK Check Error table. Manages interlock check error information.,품질,CHECK ERROR INTERLOCK 검사 에러 품질,INTERLOCK 검사 결과|INTERLOCK 검사 현황|품질 검사 현황
IQ_INTERLOCK_CHECK_RESULT,INTERLOCK 검사/확인 실적 테이블. INTERLOCK 검사/확인 실적 데이터를 기록한다.,INTERLOCK Check result table. Stores interlock check result data.,품질,CHECK INTERLOCK RESULT 검사 실적 품질,INTERLOCK 실적 조회|일일 INTERLOCK 실적|품질 검사 현황
IQ_INTERLOCK_CHECK_RESULT_SUM,INTERLOCK 검사/확인 실적 테이블. INTERLOCK 검사/확인 실적 데이터를 기록한다.,INTERLOCK Check result table. Stores interlock check result data.,품질,CHECK INTERLOCK RESULT SUM 검사 실적 품질,INTERLOCK 실적 조회|일일 INTERLOCK 실적|품질 검사 현황
IQ_INTERLOCK_REFLOW_DATA,INTERLOCK REFLOW 데이터 테이블. INTERLOCK REFLOW 관련 데이터를 저장한다.,INTERLOCK REFLOW data table. Stores interlock reflow data.,품질,DATA INTERLOCK REFLOW 검사 데이터 품질,INTERLOCK 정보 조회|INTERLOCK 현황|품질 검사 현황
IQ_INTERLOCK_REFLOW_STATUS,INTERLOCK REFLOW 상태 테이블. INTERLOCK 관련 정보를 관리한다.,INTERLOCK REFLOW Status table. Manages interlock reflow status information.,품질,INTERLOCK REFLOW STATUS 검사 상태 품질,INTERLOCK 정보 조회|INTERLOCK 현황|품질 검사 현황
IQ_INTERLOCK_REQUEST_LOG,INTERLOCK REQUEST 로그 테이블. INTERLOCK REQUEST 변경/처리 이력을 기록한다.,INTERLOCK REQUEST log table. Records interlock request change history.,품질,INTERLOCK LOG REQUEST 검사 로그 품질,INTERLOCK 이력 조회|INTERLOCK 변경 이력|품질 검사 현황
IQ_IQC_DOCUMENT,수입검사 DOCUMENT 테이블. 수입검사 관련 정보를 관리한다.,Incoming QC DOCUMENT table. Manages incoming qc document information.,품질,DOCUMENT IQC 검사 수입검사 품질,수입검사 검사 결과|수입검사 검사 현황|품질 검사 현황
IQ_IQC_INSPECT_HISTORY,수입검사 검사 이력 테이블. 수입검사 검사 변경/처리 이력을 기록한다.,Incoming QC Inspection history table. Records incoming qc inspection change history.,품질,HISTORY INSPECT IQC 검사 수입검사 이력 품질,수입검사 이력 조회|수입검사 변경 이력|품질 검사 현황
IQ_ITEM_EQUIPMENT_DETAIL,품목 EQUIPMENT 상세 테이블. 품목 관련 정보를 관리한다.,Item EQUIPMENT Detail table. Manages item equipment detail information.,품질,DETAIL EQUIPMENT ITEM 검사 상세 품목 품질,품목 정보 조회|품목 현황|품질 검사 현황
IQ_ITEM_INSPECT_GROUP,품목 검사 GROUP 테이블. 품목 검사 결과를 기록한다.,Item Inspection GROUP table. Manages item inspection group information.,품질,GROUP INSPECT ITEM 검사 품목 품질,품목 검사 결과|품목 검사 현황|품질 검사 현황
IQ_ITEM_IQC,품목 수입검사 테이블. 품목 관련 정보를 관리한다.,Item Incoming QC table. Manages item incoming qc information.,품질,IQC ITEM 검사 수입검사 품목 품질,품목 검사 결과|품목 검사 현황|품질 검사 현황
IQ_ITEM_IQC_BAD,품목 수입검사 BAD 테이블. 품목 관련 정보를 관리한다.,Item Incoming QC BAD table. Manages item incoming qc bad information.,품질,BAD IQC ITEM 검사 수입검사 품목 품질,품목 검사 결과|품목 검사 현황|품질 검사 현황
IQ_ITEM_IQC_CRITERION,품목 수입검사 CRITERION 테이블. 품목 관련 정보를 관리한다.,Item Incoming QC CRITERION table. Manages item incoming qc criterion information.,품질,CRITERION IQC ITEM 검사 수입검사 품목 품질,품목 검사 결과|품목 검사 현황|품질 검사 현황
IQ_ITEM_IQC_RANGE,품목 수입검사 RANGE 테이블. 품목 관련 정보를 관리한다.,Item Incoming QC RANGE table. Manages item incoming qc range information.,품질,IQC ITEM RANGE 검사 수입검사 품목 품질,품목 검사 결과|품목 검사 현황|품질 검사 현황
IQ_ITEM_OQC_CRITERION,품목 출하검사 CRITERION 테이블. 품목 관련 정보를 관리한다.,Item Outgoing QC CRITERION table. Manages item outgoing qc criterion information.,품질,CRITERION ITEM OQC 검사 출하검사 품목 품질,품목 검사 결과|품목 검사 현황|품질 검사 현황
IQ_LED_INSPECT_CONDITION,LED 검사 CONDITION 테이블. LED 검사 결과를 기록한다.,LED Inspection CONDITION table. Manages led inspection condition information.,품질,CONDITION INSPECT LED 검사 품질,LED 검사 결과|LED 검사 현황|품질 검사 현황
IQ_MACHINE_AOI_NG_POWER_DATA_RAW,설비 AOI 불량 데이터 테이블. 설비 AOI 불량 관련 데이터를 저장한다.,Machine AOI NG data table. Stores machine aoi ng data.,품질,AOI DATA MACHINE POWER RAW 검사 데이터 불량 설비 품질,설비 정보 조회|설비 현황|품질 검사 현황
IQ_MACHINE_AOI_POWER_DATA_RAW,설비 AOI POWER 데이터 테이블. 설비 AOI POWER 관련 데이터를 저장한다.,Machine AOI POWER data table. Stores machine aoi power data.,품질,AOI DATA MACHINE POWER RAW 검사 데이터 설비 품질,설비 정보 조회|설비 현황|품질 검사 현황
IQ_MACHINE_ATE_DTL_POWER_DATA_RAW,설비 ATE DTL 데이터 테이블. 설비 ATE DTL 관련 데이터를 저장한다.,Machine ATE DTL data table. Stores machine ate dtl data.,품질,ATE DATA DTL MACHINE POWER RAW 검사 데이터 설비 품질,설비 정보 조회|설비 현황|품질 검사 현황
IQ_MACHINE_ATE_POWER_DATA_RAW,설비 ATE POWER 데이터 테이블. 설비 ATE POWER 관련 데이터를 저장한다.,Machine ATE POWER data table. Stores machine ate power data.,품질,ATE DATA MACHINE POWER RAW 검사 데이터 설비 품질,설비 정보 조회|설비 현황|품질 검사 현황
IQ_MACHINE_ATE_POWER_SUB2_DATA_RAW,설비 ATE POWER 데이터 테이블. 설비 ATE POWER 관련 데이터를 저장한다.,Machine ATE POWER data table. Stores machine ate power data.,품질,ATE DATA MACHINE POWER RAW SUB2 검사 데이터 설비 품질,설비 정보 조회|설비 현황|품질 검사 현황
IQ_MACHINE_ATE_SERVER_DATA_RAW,설비 ATE SERVER 데이터 테이블. 설비 ATE SERVER 관련 데이터를 저장한다.,Machine ATE SERVER data table. Stores machine ate server data.,품질,ATE DATA MACHINE RAW SERVER 검사 데이터 설비 품질,설비 정보 조회|설비 현황|품질 검사 현황
IQ_MACHINE_BARCODE_DATA_RAW,설비 바코드 데이터 테이블. 설비 바코드 관련 데이터를 저장한다.,Machine Barcode data table. Stores machine barcode data.,품질,BARCODE DATA MACHINE RAW 검사 데이터 바코드 설비 품질,설비 정보 조회|설비 현황|품질 검사 현황
IQ_MACHINE_BURNIN_DTL_HYBRID_RAW,설비 BURNIN DTL HYBRID 테이블. 설비 관련 정보를 관리한다.,Machine BURNIN DTL table. Manages machine burnin dtl information.,품질,BURNIN DTL HYBRID MACHINE RAW 검사 설비 품질,설비 정보 조회|설비 현황|품질 검사 현황
IQ_MACHINE_BURNIN_HYBRID_DATA_RAW,설비 BURNIN HYBRID 데이터 테이블. 설비 BURNIN HYBRID 관련 데이터를 저장한다.,Machine BURNIN HYBRID data table. Stores machine burnin hybrid data.,품질,BURNIN DATA HYBRID MACHINE RAW 검사 데이터 설비 품질,설비 정보 조회|설비 현황|품질 검사 현황
IQ_MACHINE_BURNIN_POWER_DATA_RAW,설비 BURNIN POWER 데이터 테이블. 설비 BURNIN POWER 관련 데이터를 저장한다.,Machine BURNIN POWER data table. Stores machine burnin power data.,품질,BURNIN DATA MACHINE POWER RAW 검사 데이터 설비 품질,설비 정보 조회|설비 현황|품질 검사 현황
IQ_MACHINE_BURNIN_SMPS_DATA_RAW,설비 BURNIN SMPS 데이터 테이블. 설비 BURNIN SMPS 관련 데이터를 저장한다.,Machine BURNIN SMPS data table. Stores machine burnin smps data.,품질,BURNIN DATA MACHINE RAW SMPS 검사 데이터 설비 품질,설비 정보 조회|설비 현황|품질 검사 현황
IQ_MACHINE_CALIB_DTL_POWER_DATA_RAW,설비 CALIB DTL 데이터 테이블. 설비 CALIB DTL 관련 데이터를 저장한다.,Machine CALIB DTL data table. Stores machine calib dtl data.,품질,CALIB DATA DTL MACHINE POWER RAW 검사 데이터 설비 품질,설비 정보 조회|설비 현황|품질 검사 현황
IQ_MACHINE_CALIB_POWER_DATA_RAW,설비 CALIB POWER 데이터 테이블. 설비 CALIB POWER 관련 데이터를 저장한다.,Machine CALIB POWER data table. Stores machine calib power data.,품질,CALIB DATA MACHINE POWER RAW 검사 데이터 설비 품질,설비 정보 조회|설비 현황|품질 검사 현황
IQ_MACHINE_COATING_POWER_DATA,설비 COATING POWER 데이터 테이블. 설비 COATING POWER 관련 데이터를 저장한다.,Machine COATING POWER data table. Stores machine coating power data.,품질,COATING DATA MACHINE POWER 검사 데이터 설비 품질,설비 정보 조회|설비 현황|품질 검사 현황
IQ_MACHINE_COATING_POWER_DATA_RAW,설비 COATING POWER 데이터 테이블. 설비 COATING POWER 관련 데이터를 저장한다.,Machine COATING POWER data table. Stores machine coating power data.,품질,COATING DATA MACHINE POWER RAW 검사 데이터 설비 품질,설비 정보 조회|설비 현황|품질 검사 현황
IQ_MACHINE_CPK_ITEM_MASTER,설비 CPK 품목 마스터 테이블. 설비 CPK 품목 정보를 관리한다.,Machine CPK Item master table. Manages machine cpk item information.,품질,CPK ITEM MACHINE MASTER 검사 마스터 설비 품목 품질,설비 정보 조회|설비 목록|품질 검사 현황
IQ_MACHINE_CTRL_SERVER_DATA_RAW,설비 CTRL SERVER 데이터 테이블. 설비 CTRL SERVER 관련 데이터를 저장한다.,Machine CTRL SERVER data table. Stores machine ctrl server data.,품질,CTRL DATA MACHINE RAW SERVER 검사 데이터 설비 품질,설비 정보 조회|설비 현황|품질 검사 현황
IQ_MACHINE_DATA_RAW,설비 RAW 데이터 테이블. 설비 RAW 관련 데이터를 저장한다.,Machine RAW data table. Stores machine raw data.,품질,DATA MACHINE RAW 검사 데이터 설비 품질,설비 정보 조회|설비 현황|품질 검사 현황
IQ_MACHINE_EEPROM_SERVER_DATA_RAW,설비 EEPROM SERVER 데이터 테이블. 설비 EEPROM SERVER 관련 데이터를 저장한다.,Machine EEPROM SERVER data table. Stores machine eeprom server data.,품질,DATA EEPROM MACHINE RAW SERVER 검사 데이터 설비 품질,설비 정보 조회|설비 현황|품질 검사 현황
IQ_MACHINE_ESD_DATA_RAW,설비 ESD 데이터 테이블. 설비 ESD 관련 데이터를 저장한다.,Machine ESD data table. Stores machine esd data.,품질,DATA ESD MACHINE RAW 검사 데이터 설비 품질,설비 정보 조회|설비 현황|품질 검사 현황
IQ_MACHINE_FANTEST_POWER_DATA_RAW,설비 FANTEST POWER 데이터 테이블. 설비 FANTEST POWER 관련 데이터를 저장한다.,Machine FANTEST POWER data table. Stores machine fantest power data.,품질,DATA FANTEST MACHINE POWER RAW 검사 데이터 설비 품질,설비 정보 조회|설비 현황|품질 검사 현황
IQ_MACHINE_FCT_DTL_POWER_DATA_RAW,설비 FCT DTL 데이터 테이블. 설비 FCT DTL 관련 데이터를 저장한다.,Machine FCT DTL data table. Stores machine fct dtl data.,품질,DATA DTL FCT MACHINE POWER RAW 검사 데이터 설비 품질,설비 정보 조회|설비 현황|품질 검사 현황
IQ_MACHINE_FCT_POWER_DATA_RAW,설비 FCT POWER 데이터 테이블. 설비 FCT POWER 관련 데이터를 저장한다.,Machine FCT POWER data table. Stores machine fct power data.,품질,DATA FCT MACHINE POWER RAW 검사 데이터 설비 품질,설비 정보 조회|설비 현황|품질 검사 현황
IQ_MACHINE_FCT_SERVER_DATA_RAW,설비 FCT SERVER 데이터 테이블. 설비 FCT SERVER 관련 데이터를 저장한다.,Machine FCT SERVER data table. Stores machine fct server data.,품질,DATA FCT MACHINE RAW SERVER 검사 데이터 설비 품질,설비 정보 조회|설비 현황|품질 검사 현황
IQ_MACHINE_FT1_DTL_POWER_DATA_RAW,설비 FT1 DTL 데이터 테이블. 설비 FT1 DTL 관련 데이터를 저장한다.,Machine FT1 DTL data table. Stores machine ft1 dtl data.,품질,DATA DTL FT1 MACHINE POWER RAW 검사 데이터 설비 품질,설비 정보 조회|설비 현황|품질 검사 현황
IQ_MACHINE_FT1_POWER_DATA_RAW,설비 FT1 POWER 데이터 테이블. 설비 FT1 POWER 관련 데이터를 저장한다.,Machine FT1 POWER data table. Stores machine ft1 power data.,품질,DATA FT1 MACHINE POWER RAW 검사 데이터 설비 품질,설비 정보 조회|설비 현황|품질 검사 현황
IQ_MACHINE_FT1_SERVER_DATA_RAW,설비 FT1 SERVER 데이터 테이블. 설비 FT1 SERVER 관련 데이터를 저장한다.,Machine FT1 SERVER data table. Stores machine ft1 server data.,품질,DATA FT1 MACHINE RAW SERVER 검사 데이터 설비 품질,설비 정보 조회|설비 현황|품질 검사 현황
