table_name,table_description_ko,table_description_en,domain,keywords,sample_queries
IP_ASSEMBLY_ISSUE,ASSEMBLY 출고 테이블. ASSEMBLY 관련 정보를 관리한다.,ASSEMBLY Issue table. Manages assembly issue information.,생산,ASSEMBLY ISSUE 라인 생산 출고,ASSEMBLY 정보 조회|ASSEMBLY 현황
IP_ASSEMBLY_RESULT,ASSEMBLY 실적 테이블. ASSEMBLY 실적 데이터를 기록한다.,ASSEMBLY result table. Stores assembly result data.,생산,ASSEMBLY RESULT 라인 생산 실적,ASSEMBLY 실적 조회|일일 ASSEMBLY 실적
IP_ASSEMBLY_RESULT_BARCODE,ASSEMBLY 바코드 실적 테이블. ASSEMBLY 바코드 실적 데이터를 기록한다.,ASSEMBLY Barcode result table. Stores assembly barcode result data.,생산,ASSEMBLY BARCODE RESULT 라인 바코드 생산 실적,ASSEMBLY 실적 조회|일일 ASSEMBLY 실적
IP_ASSEMBLY_RESULT_HISTORY,ASSEMBLY 실적/결과 이력 테이블. ASSEMBLY 실적/결과 변경/처리 이력을 기록한다.,ASSEMBLY Result history table. Records assembly result change history.,생산,ASSEMBLY HISTORY RESULT 라인 생산 실적 이력,ASSEMBLY 이력 조회|ASSEMBLY 변경 이력
IP_LABEL_MASTER,라벨 마스터 테이블. 라벨 정보를 관리한다.,Label master table. Manages label information.,생산,LABEL MASTER 라벨 라인 마스터 생산,라벨 정보 조회|라벨 목록
IP_LINE_DAILY_OPERATION,라인 일일 OPERATION 테이블. 라인 관련 정보를 관리한다.,Line Daily OPERATION table. Manages line daily operation information.,생산,DAILY LINE OPERATION 라인 생산 일일,라인 정보 조회|라인 현황
IP_LINE_DAILY_OPERATION_HIST,라인 일일 OPERATION 이력 테이블. 라인 일일 OPERATION 변경/처리 이력을 기록한다.,Line Daily OPERATION history table. Records line daily operation change history.,생산,DAILY HIST LINE OPERATION 라인 생산 이력 일일,라인 이력 조회|라인 변경 이력
IP_LINE_IDLE_TIME,라인 IDLE TIME 테이블. 라인 관련 정보를 관리한다.,Line IDLE TIME table. Manages line idle time information.,생산,IDLE LINE TIME 라인 생산,라인 정보 조회|라인 현황
IP_MACHINE_DAILY_OPERATION,설비 일일 OPERATION 테이블. 설비 관련 정보를 관리한다.,Machine Daily OPERATION table. Manages machine daily operation information.,생산,DAILY MACHINE OPERATION 라인 생산 설비 일일,설비 정보 조회|설비 현황
IP_MACHINE_INSPECT_MCN_STATUS,설비 검사 MCN 상태 테이블. 설비 검사 결과를 기록한다.,Machine Inspection MCN table. Manages machine inspection mcn information.,생산,INSPECT MACHINE MCN STATUS 검사 라인 상태 생산 설비,설비 검사 결과|설비 검사 현황
IP_PRODUCT_2D_BARCODE,제품 2D 바코드 테이블. 제품 관련 정보를 관리한다.,Product 2D Barcode table. Manages product 2d barcode information.,생산,2D BARCODE PRODUCT 라인 바코드 생산 제품,제품 정보 조회|제품 현황
IP_PRODUCT_2D_BARCODE_DEL,제품 2D 바코드 DEL 테이블. 제품 관련 정보를 관리한다.,Product 2D Barcode table. Manages product 2d barcode information.,생산,2D BARCODE DEL PRODUCT 라인 바코드 생산 제품,제품 정보 조회|제품 현황
IP_PRODUCT_2D_BARCODE_PAIR,제품 2D 바코드 PAIR 테이블. 제품 관련 정보를 관리한다.,Product 2D Barcode table. Manages product 2d barcode information.,생산,2D BARCODE PAIR PRODUCT 라인 바코드 생산 제품,제품 정보 조회|제품 현황
IP_PRODUCT_CARRIER_BARCODE,제품 CARRIER 바코드 테이블. 제품 관련 정보를 관리한다.,Product CARRIER Barcode table. Manages product carrier barcode information.,생산,BARCODE CARRIER PRODUCT 라인 바코드 생산 제품,제품 정보 조회|제품 현황
IP_PRODUCT_COMPANY_CALENDAR,제품 COMPANY CALENDAR 테이블. 제품 관련 정보를 관리한다.,Product COMPANY CALENDAR table. Manages product company calendar information.,생산,CALENDAR COMPANY PRODUCT 라인 생산 제품,제품 정보 조회|제품 현황
IP_PRODUCT_DAILY_LINE_CAPACITY,제품 일일 라인 CAPACITY 테이블. 제품 관련 정보를 관리한다.,Product Daily Line table. Manages product daily line information.,생산,CAPACITY DAILY LINE PRODUCT 라인 생산 일일 제품,제품 정보 조회|제품 현황
IP_PRODUCT_DAILY_MCN_CAPACITY,제품 일일 MCN CAPACITY 테이블. 제품 관련 정보를 관리한다.,Product Daily MCN table. Manages product daily mcn information.,생산,CAPACITY DAILY MCN PRODUCT 라인 생산 일일 제품,제품 정보 조회|제품 현황
IP_PRODUCT_DAILY_RESULT,제품 일일 실적 테이블. 제품 일일 실적 데이터를 기록한다.,Product Daily result table. Stores product daily result data.,생산,DAILY PRODUCT RESULT 라인 생산 실적 일일 제품,제품 실적 조회|일일 제품 실적
IP_PRODUCT_DAILY_WS_CAPACITY,제품 일일 WS CAPACITY 테이블. 제품 관련 정보를 관리한다.,Product Daily WS table. Manages product daily ws information.,생산,CAPACITY DAILY PRODUCT WS 라인 생산 일일 제품,제품 정보 조회|제품 현황
IP_PRODUCT_DEFECT,제품 불량 테이블. 제품 관련 정보를 관리한다.,Product Defect table. Manages product defect information.,생산,DEFECT PRODUCT 라인 불량 생산 제품,제품 정보 조회|제품 현황
IP_PRODUCT_DELIVERY_MONTH_PLAN,제품 출하 MONTH 계획 테이블. 제품 계획 정보를 관리한다.,Product Delivery MONTH table. Manages product delivery month information.,생산,DELIVERY MONTH PLAN PRODUCT 계획 라인 생산 제품 출하,제품 계획 조회|당일 제품 계획
IP_PRODUCT_DELIVERY_PLAN,제품 출하 계획 테이블. 제품 계획 정보를 관리한다.,Product Delivery Plan table. Manages product delivery plan information.,생산,DELIVERY PLAN PRODUCT 계획 라인 생산 제품 출하,제품 계획 조회|당일 제품 계획
IP_PRODUCT_FG_INVENTORY,제품 FG 재고 테이블. 제품 관련 정보를 관리한다.,Product FG Inventory table. Manages product fg inventory information.,생산,FG INVENTORY PRODUCT 라인 생산 재고 제품,제품 정보 조회|제품 현황
IP_PRODUCT_FG_ISSUE,제품 FG 출고 테이블. 제품 관련 정보를 관리한다.,Product FG Issue table. Manages product fg issue information.,생산,FG ISSUE PRODUCT 라인 생산 제품 출고,제품 정보 조회|제품 현황
IP_PRODUCT_FG_PALLET,제품 FG PALLET 테이블. 제품 관련 정보를 관리한다.,Product FG PALLET table. Manages product fg pallet information.,생산,FG PALLET PRODUCT 라인 생산 제품,제품 정보 조회|제품 현황
IP_PRODUCT_FG_RECEIPT,제품 FG 입고 테이블. 제품 관련 정보를 관리한다.,Product FG Receipt table. Manages product fg receipt information.,생산,FG PRODUCT RECEIPT 라인 생산 입고 제품,제품 정보 조회|제품 현황
IP_PRODUCT_FT_DAILY_RESULTS,제품 FT 일일 RESULTS 테이블. 제품 관련 정보를 관리한다.,Product FT Daily table. Manages product ft daily information.,생산,DAILY FT PRODUCT RESULTS 라인 생산 일일 제품,제품 정보 조회|제품 현황
IP_PRODUCT_INV_4_REQUIREMENT,제품 INV REQUIREMENT 테이블. 제품 관련 정보를 관리한다.,Product INV REQUIREMENT table. Manages product inv requirement information.,생산,INV PRODUCT REQUIREMENT 라인 생산 제품,제품 정보 조회|제품 현황
IP_PRODUCT_ISSUE_PID_SCAN,제품 출고 PID SCAN 테이블. 제품 관련 정보를 관리한다.,Product Issue PID table. Manages product issue pid information.,생산,ISSUE PID PRODUCT SCAN 라인 생산 제품 출고,제품 정보 조회|제품 현황
IP_PRODUCT_LASER_MARKING,제품 LASER MARKING 테이블. 제품 관련 정보를 관리한다.,Product LASER MARKING table. Manages product laser marking information.,생산,LASER MARKING PRODUCT 라인 생산 제품,제품 정보 조회|제품 현황
IP_PRODUCT_LINE,제품 라인 테이블. 제품 관련 정보를 관리한다.,Product Line table. Manages product line information.,생산,LINE PRODUCT 라인 생산 제품,제품 정보 조회|제품 현황
IP_PRODUCT_LINE_BARCODE,제품 라인 바코드 테이블. 제품 관련 정보를 관리한다.,Product Line Barcode table. Manages product line barcode information.,생산,BARCODE LINE PRODUCT 라인 바코드 생산 제품,제품 정보 조회|제품 현황
IP_PRODUCT_LINE_CALENDAR,제품 라인 CALENDAR 테이블. 제품 관련 정보를 관리한다.,Product Line CALENDAR table. Manages product line calendar information.,생산,CALENDAR LINE PRODUCT 라인 생산 제품,제품 정보 조회|제품 현황
IP_PRODUCT_LINE_CAPACITY,제품 라인 CAPACITY 테이블. 제품 관련 정보를 관리한다.,Product Line CAPACITY table. Manages product line capacity information.,생산,CAPACITY LINE PRODUCT 라인 생산 제품,제품 정보 조회|제품 현황
IP_PRODUCT_LINE_MACHINE_MAP,제품 라인 설비 MAP 테이블. 제품 관련 정보를 관리한다.,Product Line Machine table. Manages product line machine information.,생산,LINE MACHINE MAP PRODUCT 라인 생산 설비 제품,제품 정보 조회|제품 현황
IP_PRODUCT_LINE_RESULT,제품 라인 실적 테이블. 제품 라인 실적 데이터를 기록한다.,Product Line result table. Stores product line result data.,생산,LINE PRODUCT RESULT 라인 생산 실적 제품,제품 실적 조회|일일 제품 실적
IP_PRODUCT_LINE_TARGET,제품 라인 목표 테이블. 제품 관련 정보를 관리한다.,Product Line Target table. Manages product line target information.,생산,LINE PRODUCT TARGET 라인 목표 생산 제품,제품 정보 조회|제품 현황
IP_PRODUCT_MAGAZINE,제품 MAGAZINE 테이블. 제품 관련 정보를 관리한다.,Product MAGAZINE table. Manages product magazine information.,생산,MAGAZINE PRODUCT 라인 생산 제품,제품 정보 조회|제품 현황
IP_PRODUCT_MAGAZINE_HIS,제품 MAGAZINE HIS 테이블. 제품 관련 정보를 관리한다.,Product MAGAZINE HIS table. Manages product magazine his information.,생산,HIS MAGAZINE PRODUCT 라인 생산 제품,제품 정보 조회|제품 현황
IP_PRODUCT_MAGAZINE_MASTER,제품 MAGAZINE 마스터 테이블. 제품 MAGAZINE 정보를 관리한다.,Product MAGAZINE master table. Manages product magazine information.,생산,MAGAZINE MASTER PRODUCT 라인 마스터 생산 제품,제품 정보 조회|제품 목록
IP_PRODUCT_MAINFLASH_VERSION,제품 MAINFLASH 버전 테이블. 제품 관련 정보를 관리한다.,Product MAINFLASH Version table. Manages product mainflash version information.,생산,MAINFLASH PRODUCT VERSION 라인 버전 생산 제품,제품 정보 조회|제품 현황
IP_PRODUCT_MAOI_DAILY_RESULTS,제품 MAOI 일일 RESULTS 테이블. 제품 관련 정보를 관리한다.,Product MAOI Daily table. Manages product maoi daily information.,생산,DAILY MAOI PRODUCT RESULTS 라인 생산 일일 제품,제품 정보 조회|제품 현황
IP_PRODUCT_MCN_CALENDAR,제품 MCN CALENDAR 테이블. 제품 관련 정보를 관리한다.,Product MCN CALENDAR table. Manages product mcn calendar information.,생산,CALENDAR MCN PRODUCT 라인 생산 제품,제품 정보 조회|제품 현황
IP_PRODUCT_MI_MONTH_PLAN,제품 MI MONTH 계획 테이블. 제품 계획 정보를 관리한다.,Product MI MONTH table. Manages product mi month information.,생산,MI MONTH PLAN PRODUCT 계획 라인 생산 제품,제품 계획 조회|당일 제품 계획
IP_PRODUCT_MI_PLAN,제품 MI 계획 테이블. 제품 계획 정보를 관리한다.,Product MI Plan table. Manages product mi plan information.,생산,MI PLAN PRODUCT 계획 라인 생산 제품,제품 계획 조회|당일 제품 계획
IP_PRODUCT_MOBILIZATION,제품 MOBILIZATION 테이블. 제품 관련 정보를 관리한다.,Product MOBILIZATION table. Manages product mobilization information.,생산,MOBILIZATION PRODUCT 라인 생산 제품,제품 정보 조회|제품 현황
IP_PRODUCT_MODEL_CT_MASTER,제품 모델 CT 마스터 테이블. 제품 모델 CT 정보를 관리한다.,Product Model CT master table. Manages product model ct information.,생산,CT MASTER MODEL PRODUCT 라인 마스터 모델 생산 제품,제품 정보 조회|제품 목록
IP_PRODUCT_MODEL_INSPECTION,제품 모델 INSPECTION 테이블. 제품 관련 정보를 관리한다.,Product Model INSPECTION table. Manages product model inspection information.,생산,INSPECTION MODEL PRODUCT 라인 모델 생산 제품,제품 정보 조회|제품 현황
IP_PRODUCT_MODEL_MASTER,제품 모델 마스터 테이블. 제품 모델 정보를 관리한다.,Product Model master table. Manages product model information.,생산,MASTER MODEL PRODUCT 라인 마스터 모델 생산 제품,제품 정보 조회|제품 목록
IP_PRODUCT_MODEL_MASTER_ATTRIBUTES,제품 모델 마스터 테이블. 제품 모델 정보를 관리한다.,Product Model master table. Manages product model information.,생산,ATTRIBUTES MASTER MODEL PRODUCT 라인 마스터 모델 생산 제품,제품 정보 조회|제품 목록
IP_PRODUCT_MODEL_MASTER_MD_MODEL,제품 모델 마스터 테이블. 제품 모델 정보를 관리한다.,Product Model master table. Manages product model information.,생산,MASTER MD MODEL PRODUCT 라인 마스터 모델 생산 제품,제품 정보 조회|제품 목록
IP_PRODUCT_MODEL_MICOM_HISOTRY,제품 모델 MICOM HISOTRY 테이블. 제품 관련 정보를 관리한다.,Product Model MICOM table. Manages product model micom information.,생산,HISOTRY MICOM MODEL PRODUCT 라인 모델 생산 제품,제품 정보 조회|제품 현황
IP_PRODUCT_MODEL_OTP,제품 모델 OTP 테이블. 제품 관련 정보를 관리한다.,Product Model OTP table. Manages product model otp information.,생산,MODEL OTP PRODUCT 라인 모델 생산 제품,제품 정보 조회|제품 현황
IP_PRODUCT_MODEL_ST_MASTER,제품 모델 ST 마스터 테이블. 제품 모델 ST 정보를 관리한다.,Product Model ST master table. Manages product model st information.,생산,MASTER MODEL PRODUCT ST 라인 마스터 모델 생산 제품,제품 정보 조회|제품 목록
IP_PRODUCT_MOLD_CALENDAR,제품 금형 CALENDAR 테이블. 제품 관련 정보를 관리한다.,Product Mold CALENDAR table. Manages product mold calendar information.,생산,CALENDAR MOLD PRODUCT 금형 라인 생산 제품,제품 정보 조회|제품 현황
IP_PRODUCT_OEMBOX_MASTER,제품 OEMBOX 마스터 테이블. 제품 OEMBOX 정보를 관리한다.,Product OEMBOX master table. Manages product oembox information.,생산,MASTER OEMBOX PRODUCT 라인 마스터 생산 제품,제품 정보 조회|제품 목록
IP_PRODUCT_PACK_ASSY_MASTER,제품 PACK ASSY 마스터 테이블. 제품 PACK ASSY 정보를 관리한다.,Product PACK ASSY master table. Manages product pack assy information.,생산,ASSY MASTER PACK PRODUCT 라인 마스터 생산 제품,제품 정보 조회|제품 목록
IP_PRODUCT_PACK_MASTER,제품 PACK 마스터 테이블. 제품 PACK 정보를 관리한다.,Product PACK master table. Manages product pack information.,생산,MASTER PACK PRODUCT 라인 마스터 생산 제품,제품 정보 조회|제품 목록
IP_PRODUCT_PACK_MASTER_DEL,제품 PACK 마스터 테이블. 제품 PACK 정보를 관리한다.,Product PACK master table. Manages product pack information.,생산,DEL MASTER PACK PRODUCT 라인 마스터 생산 제품,제품 정보 조회|제품 목록
IP_PRODUCT_PACK_SCAN_HISTORY,제품 PACK SCAN 이력 테이블. 제품 PACK SCAN 변경/처리 이력을 기록한다.,Product PACK SCAN history table. Records product pack scan change history.,생산,HISTORY PACK PRODUCT SCAN 라인 생산 이력 제품,제품 이력 조회|제품 변경 이력
IP_PRODUCT_PACK_SERIAL,제품 PACK SERIAL 테이블. 제품 관련 정보를 관리한다.,Product PACK SERIAL table. Manages product pack serial information.,생산,PACK PRODUCT SERIAL 라인 생산 제품,제품 정보 조회|제품 현황
IP_PRODUCT_PACK_SERIAL_DEL,제품 PACK SERIAL DEL 테이블. 제품 관련 정보를 관리한다.,Product PACK SERIAL table. Manages product pack serial information.,생산,DEL PACK PRODUCT SERIAL 라인 생산 제품,제품 정보 조회|제품 현황
IP_PRODUCT_PCB_DEPARTURE,제품 PCB DEPARTURE 테이블. 제품 관련 정보를 관리한다.,Product PCB DEPARTURE table. Manages product pcb departure information.,생산,DEPARTURE PCB PRODUCT 라인 생산 제품,제품 정보 조회|제품 현황
IP_PRODUCT_PCB_DEPARTURE_LOAD,제품 PCB DEPARTURE LOAD 테이블. 제품 관련 정보를 관리한다.,Product PCB DEPARTURE table. Manages product pcb departure information.,생산,DEPARTURE LOAD PCB PRODUCT 라인 생산 제품,제품 정보 조회|제품 현황
IP_PRODUCT_PCB_PURIFYING,제품 PCB PURIFYING 테이블. 제품 관련 정보를 관리한다.,Product PCB PURIFYING table. Manages product pcb purifying information.,생산,PCB PRODUCT PURIFYING 라인 생산 제품,제품 정보 조회|제품 현황
IP_PRODUCT_PCB_SCAN_MASTER,제품 PCB SCAN 마스터 테이블. 제품 PCB SCAN 정보를 관리한다.,Product PCB SCAN master table. Manages product pcb scan information.,생산,MASTER PCB PRODUCT SCAN 라인 마스터 생산 제품,제품 정보 조회|제품 목록
IP_PRODUCT_PCB_SCAN_MASTER_MT,제품 PCB SCAN 마스터 테이블. 제품 PCB SCAN 정보를 관리한다.,Product PCB SCAN master table. Manages product pcb scan information.,생산,MASTER MT PCB PRODUCT SCAN 라인 마스터 생산 제품,제품 정보 조회|제품 목록
IP_PRODUCT_PDA_SCAN_MASTER,제품 PDA SCAN 마스터 테이블. 제품 PDA SCAN 정보를 관리한다.,Product PDA SCAN master table. Manages product pda scan information.,생산,MASTER PDA PRODUCT SCAN 라인 마스터 생산 제품,제품 정보 조회|제품 목록
IP_PRODUCT_PIDCHECK_HISTORY,제품 PIDCHECK 이력 테이블. 제품 PIDCHECK 변경/처리 이력을 기록한다.,Product PIDCHECK history table. Records product pidcheck change history.,생산,HISTORY PIDCHECK PRODUCT 라인 생산 이력 제품,제품 이력 조회|제품 변경 이력
IP_PRODUCT_PREPARE_IMAGE,제품 PREPARE 이미지 테이블. 제품 관련 정보를 관리한다.,Product PREPARE Image table. Manages product prepare image information.,생산,IMAGE PREPARE PRODUCT 라인 생산 이미지 제품,제품 정보 조회|제품 현황
IP_PRODUCT_PREPARE_LIST,제품 PREPARE LIST 테이블. 제품 관련 정보를 관리한다.,Product PREPARE LIST table. Manages product prepare list information.,생산,LIST PREPARE PRODUCT 라인 생산 제품,제품 정보 조회|제품 현황
IP_PRODUCT_PREPARE_MASTER,제품 PREPARE 마스터 테이블. 제품 PREPARE 정보를 관리한다.,Product PREPARE master table. Manages product prepare information.,생산,MASTER PREPARE PRODUCT 라인 마스터 생산 제품,제품 정보 조회|제품 목록
IP_PRODUCT_REINPUT_RESULT,제품 REINPUT 실적 테이블. 제품 REINPUT 실적 데이터를 기록한다.,Product REINPUT result table. Stores product reinput result data.,생산,PRODUCT REINPUT RESULT 라인 생산 실적 제품,제품 실적 조회|일일 제품 실적
IP_PRODUCT_REPAIR,제품 수리 테이블. 제품 관련 정보를 관리한다.,Product Repair table. Manages product repair information.,생산,PRODUCT REPAIR 라인 생산 수리 제품,제품 정보 조회|제품 현황
IP_PRODUCT_RESULT,제품 실적 테이블. 제품 실적 데이터를 기록한다.,Product result table. Stores product result data.,생산,PRODUCT RESULT 라인 생산 실적 제품,제품 실적 조회|일일 제품 실적
IP_PRODUCT_RESULT_BARCODE,제품 바코드 실적 테이블. 제품 바코드 실적 데이터를 기록한다.,Product Barcode result table. Stores product barcode result data.,생산,BARCODE PRODUCT RESULT 라인 바코드 생산 실적 제품,제품 실적 조회|일일 제품 실적
IP_PRODUCT_RESULT_HISTORY,제품 실적/결과 이력 테이블. 제품 실적/결과 변경/처리 이력을 기록한다.,Product Result history table. Records product result change history.,생산,HISTORY PRODUCT RESULT 라인 생산 실적 이력 제품,제품 이력 조회|제품 변경 이력
IP_PRODUCT_REWORK_RESULT,제품 REWORK 실적 테이블. 제품 REWORK 실적 데이터를 기록한다.,Product REWORK result table. Stores product rework result data.,생산,PRODUCT RESULT REWORK 라인 생산 실적 제품,제품 실적 조회|일일 제품 실적
IP_PRODUCT_ROUTING,제품 ROUTING 테이블. 제품 관련 정보를 관리한다.,Product ROUTING table. Manages product routing information.,생산,PRODUCT ROUTING 라인 생산 제품,제품 정보 조회|제품 현황
IP_PRODUCT_ROUTING_MASTER,제품 ROUTING 마스터 테이블. 제품 ROUTING 정보를 관리한다.,Product ROUTING master table. Manages product routing information.,생산,MASTER PRODUCT ROUTING 라인 마스터 생산 제품,제품 정보 조회|제품 목록
IP_PRODUCT_RUNNING_HIST,제품 RUNNING 이력 테이블. 제품 RUNNING 변경/처리 이력을 기록한다.,Product RUNNING history table. Records product running change history.,생산,HIST PRODUCT RUNNING 라인 생산 이력 제품,제품 이력 조회|제품 변경 이력
IP_PRODUCT_RUN_CARD,제품 런 카드 테이블. 제품 관련 정보를 관리한다.,Product Run Card table. Manages product run card information.,생산,CARD PRODUCT RUN 라인 생산 제품 카드,제품 정보 조회|제품 현황
IP_PRODUCT_RUN_CARD_CLOSE,제품 런 카드 CLOSE 테이블. 제품 관련 정보를 관리한다.,Product Run Card table. Manages product run card information.,생산,CARD CLOSE PRODUCT RUN 라인 생산 제품 카드,제품 정보 조회|제품 현황
IP_PRODUCT_RUN_CARD_DEL,제품 런 카드 DEL 테이블. 제품 관련 정보를 관리한다.,Product Run Card table. Manages product run card information.,생산,CARD DEL PRODUCT RUN 라인 생산 제품 카드,제품 정보 조회|제품 현황
IP_PRODUCT_RUN_CARD_DETAIL,제품 런 카드 상세 테이블. 제품 관련 정보를 관리한다.,Product Run Card table. Manages product run card information.,생산,CARD DETAIL PRODUCT RUN 라인 상세 생산 제품 카드,제품 정보 조회|제품 현황
IP_PRODUCT_RUN_CARD_INV,제품 런 카드 INV 테이블. 제품 관련 정보를 관리한다.,Product Run Card table. Manages product run card information.,생산,CARD INV PRODUCT RUN 라인 생산 제품 카드,제품 정보 조회|제품 현황
IP_PRODUCT_RUN_CARD_INV_DEL,제품 런 카드 INV 테이블. 제품 관련 정보를 관리한다.,Product Run Card table. Manages product run card information.,생산,CARD DEL INV PRODUCT RUN 라인 생산 제품 카드,제품 정보 조회|제품 현황
IP_PRODUCT_RUN_CARD_IO,제품 런 카드 IO 테이블. 제품 관련 정보를 관리한다.,Product Run Card table. Manages product run card information.,생산,CARD IO PRODUCT RUN 라인 생산 제품 카드,제품 정보 조회|제품 현황
IP_PRODUCT_RUN_CARD_IO_BACK,제품 런 카드 IO 테이블. 제품 관련 정보를 관리한다.,Product Run Card table. Manages product run card information.,생산,BACK CARD IO PRODUCT RUN 라인 생산 제품 카드,제품 정보 조회|제품 현황
IP_PRODUCT_RUN_CARD_ISSUE,제품 런 카드 출고 테이블. 제품 관련 정보를 관리한다.,Product Run Card table. Manages product run card information.,생산,CARD ISSUE PRODUCT RUN 라인 생산 제품 출고 카드,제품 정보 조회|제품 현황
IP_PRODUCT_RUN_CARD_ISSUE_DEL,제품 런 카드 출고 테이블. 제품 관련 정보를 관리한다.,Product Run Card table. Manages product run card information.,생산,CARD DEL ISSUE PRODUCT RUN 라인 생산 제품 출고 카드,제품 정보 조회|제품 현황
IP_PRODUCT_RUN_CARD_RECEIPT,제품 런 카드 입고 테이블. 제품 관련 정보를 관리한다.,Product Run Card table. Manages product run card information.,생산,CARD PRODUCT RECEIPT RUN 라인 생산 입고 제품 카드,제품 정보 조회|제품 현황
IP_PRODUCT_RUN_CARD_RECEIPT_DEL,제품 런 카드 입고 테이블. 제품 관련 정보를 관리한다.,Product Run Card table. Manages product run card information.,생산,CARD DEL PRODUCT RECEIPT RUN 라인 생산 입고 제품 카드,제품 정보 조회|제품 현황
IP_PRODUCT_RUN_MODEL,제품 런 모델 테이블. 제품 관련 정보를 관리한다.,Product Run Model table. Manages product run model information.,생산,MODEL PRODUCT RUN 라인 모델 생산 제품,제품 정보 조회|제품 현황
IP_PRODUCT_RUN_MODEL_LOG,제품 런 모델 로그 테이블. 제품 런 모델 변경/처리 이력을 기록한다.,Product Run Model log table. Records product run model change history.,생산,LOG MODEL PRODUCT RUN 라인 로그 모델 생산 제품,제품 이력 조회|제품 변경 이력
IP_PRODUCT_SAOI_DAILY_RESULTS,제품 SAOI 일일 RESULTS 테이블. 제품 관련 정보를 관리한다.,Product SAOI Daily table. Manages product saoi daily information.,생산,DAILY PRODUCT RESULTS SAOI 라인 생산 일일 제품,제품 정보 조회|제품 현황
IP_PRODUCT_SCAN_HISTORY,제품 SCAN 이력 테이블. 제품 SCAN 변경/처리 이력을 기록한다.,Product SCAN history table. Records product scan change history.,생산,HISTORY PRODUCT SCAN 라인 생산 이력 제품,제품 이력 조회|제품 변경 이력
IP_PRODUCT_SCAN_INPUT_HISTORY,제품 SCAN INPUT 이력 테이블. 제품 SCAN INPUT 변경/처리 이력을 기록한다.,Product SCAN INPUT history table. Records product scan input change history.,생산,HISTORY INPUT PRODUCT SCAN 라인 생산 이력 제품,제품 이력 조회|제품 변경 이력
IP_PRODUCT_SCAN_MAPPING_HISTORY,제품 SCAN MAPPING 이력 테이블. 제품 SCAN MAPPING 변경/처리 이력을 기록한다.,Product SCAN MAPPING history table. Records product scan mapping change history.,생산,HISTORY MAPPING PRODUCT SCAN 라인 생산 이력 제품,제품 이력 조회|제품 변경 이력
